name,type,episodes,members,score_members,rating,genre,dates,Description,Image-SRC,english_name,url
Fullmetal Alchemist: Brotherhood,TV,64.0,2695066.0,1639865.0,9.15,"['Action', 'Adventure', 'Comedy', 'Drama', 'Fantasy', 'Military', 'Shounen']",        Apr 2009 - Jul 2010,"['After a horrific alchemy experiment goes wrong in the Elric household, brothers Edward and Alphonse are left in a catastrophic new reality. Ignoring the alchemical principle banning human transmutation, the boys attempted to bring their recently deceased mother back to life. Instead, they suffered brutal personal loss: Alphonse\'s body disintegrated while Edward lost a leg and then sacrificed an arm to keep Alphonse\'s soul in the physical realm by binding it to a hulking suit of armor.\n\r\nThe brothers are rescued by their neighbor Pinako Rockbell and her granddaughter Winry. Known as a bio-mechanical engineering prodigy, Winry creates prosthetic limbs for Edward by utilizing ""automail,"" a tough, versatile metal used in robots and combat armor. After years of training, the Elric brothers set off on a quest to restore their bodies by locating the Philosopher\'s Stone—a powerful gem that allows an alchemist to defy the traditional laws of Equivalent Exchange.\n\r\nAs Edward becomes an infamous alchemist and gains the nickname ""Fullmetal,"" the boys\' journey embroils them in a growing conspiracy that threatens the fate of the world.\n\r\n[Written by MAL Rewrite]']",https://cdn.myanimelist.net/images/anime/1223/96541.jpg,,https://myanimelist.net/anime/5114/Fullmetal_Alchemist__Brotherhood
Gintama°,TV,51.0,489442.0,173224.0,9.09,"['Action', 'Comedy', 'Sci-Fi', 'Historical', 'Parody', 'Samurai', 'Shounen']",        Apr 2015 - Mar 2016,"[""Gintoki, Shinpachi, and Kagura return as the fun-loving but broke members of the Yorozuya team! Living in an alternate-reality Edo, where swords are prohibited and alien overlords have conquered Japan, they try to thrive on doing whatever work they can get their hands on. However, Shinpachi and Kagura still haven't been paid... Does Gin-chan really spend all that cash playing pachinko?\n\r\nMeanwhile, when Gintoki drunkenly staggers home one night, an alien spaceship crashes nearby. A fatally injured crew member emerges from the ship and gives Gintoki a strange, clock-shaped device, warning him that it is incredibly powerful and must be safeguarded. Mistaking it for his alarm clock, Gintoki proceeds to smash the device the next morning and suddenly discovers that the world outside his apartment has come to a standstill. With Kagura and Shinpachi at his side, he sets off to get the device fixed; though, as usual, nothing is ever that simple for the Yorozuya team.\n\r\nFilled with tongue-in-cheek humor and moments of heartfelt emotion, Gintama's fourth season finds Gintoki and his friends facing both their most hilarious misadventures and most dangerous crises yet.\n\r\n[Written by MAL Rewrite]""]",https://cdn.myanimelist.net/images/anime/3/72078.jpg,Gintama Season 4,https://myanimelist.net/anime/28977/Gintama°
Shingeki no Kyojin Season 3 Part 2,TV,10.0,1602372.0,1108307.0,9.09,"['Action', 'Drama', 'Fantasy', 'Mystery', 'Military', 'SuperPower', 'Shounen']",        Apr 2019 - Jul 2019,"['Seeking to restore humanity\'s diminishing hope, the Survey Corps embark on a mission to retake Wall Maria, where the battle against the merciless ""Titans"" takes the stage once again.\n\r\nReturning to the tattered Shiganshina District that was once his home, Eren Yeager and the Corps find the town oddly unoccupied by Titans. Even after the outer gate is plugged, they strangely encounter no opposition. The mission progresses smoothly until Armin Arlert, highly suspicious of the enemy\'s absence, discovers distressing signs of a potential scheme against them. \n\nShingeki no Kyojin Season 3 Part 2 follows Eren as he vows to take back everything that was once his. Alongside him, the Survey Corps strive—through countless sacrifices—to carve a path towards victory and uncover the secrets locked away in the Yeager family\'s basement.\n\r\n[Written by MAL Rewrite]']",https://cdn.myanimelist.net/images/anime/1517/100633.jpg,Attack on Titan Season 3 Part 2,https://myanimelist.net/anime/38524/Shingeki_no_Kyojin_Season_3_Part_2
Steins;Gate,TV,24.0,2104657.0,1122368.0,9.09,"['Drama', 'Sci-Fi', 'Suspense', 'Psychological']",        Apr 2011 - Sep 2011,"['The self-proclaimed mad scientist Rintarou Okabe rents out a room in a rickety old building in Akihabara, where he indulges himself in his hobby of inventing prospective ""future gadgets"" with fellow lab members: Mayuri Shiina, his air-headed childhood friend, and Hashida Itaru, a perverted hacker nicknamed ""Daru."" The three pass the time by tinkering with their most promising contraption yet, a machine dubbed the ""Phone Microwave,"" which performs the strange function of morphing bananas into piles of green gel.\n\r\nThough miraculous in itself, the phenomenon doesn\'t provide anything concrete in Okabe\'s search for a scientific breakthrough; that is, until the lab members are spurred into action by a string of mysterious happenings before stumbling upon an unexpected success—the Phone Microwave can send emails to the past, altering the flow of history.\n\r\nAdapted from the critically acclaimed visual novel by 5pb. and Nitroplus, Steins;Gate takes Okabe through the depths of scientific theory and practicality. Forced across the diverging threads of past and present, Okabe must shoulder the burdens that come with holding the key to the realm of time.\n\r\n[Written by MAL Rewrite]']",https://cdn.myanimelist.net/images/anime/5/73199.jpg,,https://myanimelist.net/anime/9253/Steins_Gate
Fruits Basket: The Final,TV,13.0,277442.0,118724.0,9.06,"['Comedy', 'Drama', 'Romance', 'SliceofLife', 'Supernatural', 'Shoujo']",        Apr 2021 - Jun 2021,"['Hundreds of years ago, the Chinese Zodiac spirits and their god swore to stay together eternally. United by this promise, the possessed members of the Souma family shall always return to each other under any circumstances. Yet, when these bonds shackle them from freedom, it becomes an undesirable burden—a curse. As head of the clan, Akito is convinced that he shares a special connection with the other Soumas. While he desperately clings to this fantasy, the rest of the family remains isolated and suppressed by the fear of punishment.\n\r\nTooru Honda, who has grown attached to the Soumas, is determined to break the chains that bind them. Her companionship with the family and her friends encourages her to move forward with lifting the curse. However, due to confounding revelations, she struggles to find the tenacity to continue her endeavors. With time slowly withering away, Tooru contends with an uncertain future in hopes of reaching the tranquility that may lie beyond all this commotion.\n\r\n[Written by MAL Rewrite]']",https://cdn.myanimelist.net/images/anime/1085/114792.jpg,,https://myanimelist.net/anime/42938/Fruits_Basket__The_Final
Gintama',TV,51.0,432195.0,181135.0,9.06,"['Action', 'Comedy', 'Sci-Fi', 'Historical', 'Parody', 'Samurai', 'Shounen']",        Apr 2011 - Mar 2012,"[""After a one-year hiatus, Shinpachi Shimura returns to Edo, only to stumble upon a shocking surprise: Gintoki and Kagura, his fellow Yorozuya members, have become completely different characters! Fleeing from the Yorozuya headquarters in confusion, Shinpachi finds that all the denizens of Edo have undergone impossibly extreme changes, in both appearance and personality. Most unbelievably, his sister Otae has married the Shinsengumi chief and shameless stalker Isao Kondou and is pregnant with their first child.\n\r\nBewildered, Shinpachi agrees to join the Shinsengumi at Otae and Kondou's request and finds even more startling transformations afoot both in and out of the ranks of the the organization. However, discovering that Vice Chief Toushirou Hijikata has remained unchanged, Shinpachi and his unlikely Shinsengumi ally set out to return the city of Edo to how they remember it.\n\r\nWith even more dirty jokes, tongue-in-cheek parodies, and shameless references, Gintama' follows the Yorozuya team through more of their misadventures in the vibrant, alien-filled world of Edo.\n\r\n[Written by MAL Rewrite]""]",https://cdn.myanimelist.net/images/anime/4/50361.jpg,Gintama Season 2,https://myanimelist.net/anime/9969/Gintama
Hunter x Hunter (2011),TV,148.0,2171589.0,1275804.0,9.06,"['Action', 'Adventure', 'Fantasy', 'SuperPower', 'Shounen']",        Oct 2011 - Sep 2014,"['Hunter x Hunter is set in a world where Hunters exist to perform all manner of dangerous tasks like capturing criminals and bravely searching for lost treasures in uncharted territories. Twelve-year-old Gon Freecss is determined to become the best Hunter possible in hopes of finding his father, who was a Hunter himself and had long ago abandoned his young son. However, Gon soon realizes the path to achieving his goals is far more challenging than he could have ever imagined.\n\r\nAlong the way to becoming an official Hunter, Gon befriends the lively doctor-in-training Leorio, vengeful Kurapika, and rebellious ex-assassin Killua. To attain their own goals and desires, together the four of them take the Hunter Exam, notorious for its low success rate and high probability of death. Throughout their journey, Gon and his friends embark on an adventure that puts them through many hardships and struggles. They will meet a plethora of monsters, creatures, and characters—all while learning what being a Hunter truly means.\n\r\n[Written by MAL Rewrite]']",https://cdn.myanimelist.net/images/anime/1337/99013.jpg,Hunter x Hunter,https://myanimelist.net/anime/11061/Hunter_x_Hunter_2011
Ginga Eiyuu Densetsu,OVA,110.0,264511.0,58857.0,9.04,"['Drama', 'Sci-Fi', 'Military', 'Space']",        Jan 1988 - Mar 1997,"[""The 150-year-long stalemate between the two interstellar superpowers, the Galactic Empire and the Free Planets Alliance, comes to an end when a new generation of leaders arises: the idealistic military genius Reinhard von Lohengramm, and the FPA's reserved historian, Yang Wenli.\n\r\nWhile Reinhard climbs the ranks of the Empire with the aid of his childhood friend, Siegfried Kircheis, he must fight not only the war, but also the remnants of the crumbling Goldenbaum Dynasty in order to free his sister from the Kaiser and unify humanity under one genuine ruler. Meanwhile, on the other side of the galaxy, Yang—a strong supporter of democratic ideals—has to stand firm in his beliefs, despite the struggles of the FPA, and show his pupil, Julian Mintz, that autocracy is not the solution.\n\r\nAs ideologies clash amidst the war's many casualties, the two strategic masterminds must ask themselves what the real reason behind their battle is.\n\r\n[Written by MAL Rewrite]""]",https://cdn.myanimelist.net/images/anime/13/13225.jpg,Legend of the Galactic Heroes,https://myanimelist.net/anime/820/Ginga_Eiyuu_Densetsu
Gintama': Enchousen,TV,13.0,263148.0,131919.0,9.04,"['Action', 'Comedy', 'Sci-Fi', 'Historical', 'Parody', 'Samurai', 'Shounen']",        Oct 2012 - Mar 2013,"[""While Gintoki Sakata was away, the Yorozuya found themselves a new leader: Kintoki, Gintoki's golden-haired doppelganger. In order to regain his former position, Gintoki will need the help of those around him, a troubling feat when no one can remember him! Between Kintoki and Gintoki, who will claim the throne as the main character?\n\r\nIn addition, Yorozuya make a trip back down to red-light district of Yoshiwara to aid an elderly courtesan in her search for her long-lost lover. Although the district is no longer in chains beneath the earth's surface, the trio soon learn of the tragic backstories of Yoshiwara's inhabitants that still haunt them. With flashback after flashback, this quest has Yorozuya witnessing everlasting love and protecting it as best they can with their hearts and souls.\n\nGintama': Enchousen includes moments of action-packed intensity along with their usual lighthearted, slapstick humor for Gintoki and his friends.\n\r\n[Written by MAL Rewrite]""]",https://cdn.myanimelist.net/images/anime/6/75172.jpg,Gintama: Enchousen,https://myanimelist.net/anime/15417/Gintama__Enchousen
Gintama: The Final,Movie,1.0,80065.0,31826.0,9.01,"['Action', 'Comedy', 'Drama', 'Sci-Fi', 'Historical', 'Parody', 'Samurai', 'Shounen']",        Jan 2021 - Jan 2021,['New Gintama movie.'],https://cdn.myanimelist.net/images/anime/1245/116760.jpg,,https://myanimelist.net/anime/39486/Gintama__The_Final
Gintama.,TV,12.0,246747.0,110051.0,8.98,"['Action', 'Comedy', 'Sci-Fi', 'Historical', 'Parody', 'Samurai', 'Shounen']",        Jan 2017 - Mar 2017,"[""After joining the resistance against the bakufu, Gintoki and the gang are in hiding, along with Katsura and his Joui rebels. The Yorozuya is soon approached by Nobume Imai and two members of the Kiheitai, who explain that the Harusame pirates have turned against 7th Division Captain Kamui and their former ally Takasugi. The Kiheitai present Gintoki with a job: find Takasugi, who has been missing since his ship was ambushed in a Harusame raid. Nobume also makes a stunning revelation regarding the Tendoushuu, a secret organization pulling the strings of numerous factions, and their leader Utsuro, the shadowy figure with an uncanny resemblance to Gintoki's former teacher.\n\r\nHitching a ride on Sakamoto's space ship, the Yorozuya and Katsura set out for Rakuyou, Kagura's home planet, where the various factions have gathered and tensions are brewing. Long-held grudges, political infighting, and the Tendoushuu's sinister overarching plan finally culminate into a massive, decisive battle on Rakuyou.\n\r\n[Written by MAL Rewrite]""]",https://cdn.myanimelist.net/images/anime/3/83528.jpg,Gintama Season 5,https://myanimelist.net/anime/34096/Gintama
3-gatsu no Lion 2nd Season,TV,22.0,324991.0,156965.0,8.97,"['Drama', 'SliceofLife', 'Game', 'Seinen']",        Oct 2017 - Mar 2018,"['Now in his second year of high school, Rei Kiriyama continues pushing through his struggles in the professional shogi world as well as his personal life. Surrounded by vibrant personalities at the shogi hall, the school club, and in the local community, his solitary shell slowly begins to crack. Among them are the three Kawamoto sisters—Akari, Hinata, and Momo—who forge an affectionate and familial bond with Rei. Through these ties, he realizes that everyone is burdened by their own emotional hardships and begins learning how to rely on others while supporting them in return. \n\r\nNonetheless, the life of a professional is not easy. Between tournaments, championships, and title matches, the pressure mounts as Rei advances through the ranks and encounters incredibly skilled opponents. As he manages his relationships with those who have grown close to him, the shogi player continues to search for the reason he plays the game that defines his career.\n\r\n[Written by MAL Rewrite]']",https://cdn.myanimelist.net/images/anime/3/88469.jpg,March Comes In Like A Lion 2nd Season,https://myanimelist.net/anime/35180/3-gatsu_no_Lion_2nd_Season
Koe no Katachi,Movie,1.0,1799350.0,1239283.0,8.97,"['Drama', 'School', 'Shounen']",        Sep 2016 - Sep 2016,"[""As a wild youth, elementary school student Shouya Ishida sought to beat boredom in the cruelest ways. When the deaf Shouko Nishimiya transfers into his class, Shouya and the rest of his class thoughtlessly bully her for fun. However, when her mother notifies the school, he is singled out and blamed for everything done to her. With Shouko transferring out of the school, Shouya is left at the mercy of his classmates. He is heartlessly ostracized all throughout elementary and middle school, while teachers turn a blind eye.\n\r\nNow in his third year of high school, Shouya is still plagued by his wrongdoings as a young boy. Sincerely regretting his past actions, he sets out on a journey of redemption: to meet Shouko once more and make amends.\n\nKoe no Katachi tells the heartwarming tale of Shouya's reunion with Shouko and his honest attempts to redeem himself, all while being continually haunted by the shadows of his past.\n\r\n[Written by MAL Rewrite]""]",https://cdn.myanimelist.net/images/anime/1122/96435.jpg,A Silent Voice,https://myanimelist.net/anime/28851/Koe_no_Katachi
Violet Evergarden Movie,Movie,1.0,342773.0,104401.0,8.97,"['Drama', 'Fantasy', 'SliceofLife']",        Sep 2020 - Sep 2020,"['Several years have passed since the end of The Great War. As the radio tower in Leidenschaftlich continues to be built, telephones will soon become more relevant, leading to a decline in demand for ""Auto Memory Dolls."" Even so, Violet Evergarden continues to rise in fame after her constant success with writing letters. However, sometimes the one thing you long for is the one thing that does not appear.\n\nViolet Evergarden Movie follows Violet as she continues to comprehend the concept of emotion and the meaning of love. At the same time, she pursues a glimmer of hope that the man who once told her, ""I love you,"" may still be alive even after the many years that have passed.\n\r\n[Written by MAL Rewrite]']",https://cdn.myanimelist.net/images/anime/1825/110716.jpg,,https://myanimelist.net/anime/37987/Violet_Evergarden_Movie
Clannad: After Story,TV,24.0,1030512.0,572589.0,8.95,"['Comedy', 'Drama', 'Romance', 'SliceofLife', 'Supernatural']",        Oct 2008 - Mar 2009,"[""Clannad: After Story, the sequel to the critically acclaimed slice-of-life series Clannad, begins after Tomoya Okazaki and Nagisa Furukawa graduate from high school. Together, they experience the emotional rollercoaster of growing up. Unable to decide on a course for his future, Tomoya learns the value of a strong work ethic and discovers the strength of Nagisa's support. Through the couple's dedication and unity of purpose, they push forward to confront their personal problems, deepen their old relationships, and create new bonds.\n\r\nTime also moves on in the Illusionary World. As the plains grow cold with the approach of winter, the Illusionary Girl and the Garbage Doll are presented with a difficult situation that reveals the World's true purpose.\n\r\nBased on the visual novel by Key and produced by Kyoto Animation, Clannad: After Story is an impactful drama highlighting the importance of family and the struggles of adulthood.\n\r\n[Written by MAL Rewrite]""]",https://cdn.myanimelist.net/images/anime/1299/110774.jpg,Clannad ~After Story~,https://myanimelist.net/anime/4181/Clannad__After_Story
Gintama,TV,201.0,892074.0,266792.0,8.95,"['Action', 'Comedy', 'Sci-Fi', 'Historical', 'Parody', 'Samurai', 'Shounen']",        Apr 2006 - Mar 2010,"['The Amanto, aliens from outer space, have invaded Earth and taken over feudal Japan. As a result, a prohibition on swords has been established, and the samurai of Japan are treated with disregard as a consequence.\n\r\nHowever one man, Gintoki Sakata, still possesses the heart of the samurai, although from his love of sweets and work as a yorozuya, one might not expect it. Accompanying him in his jack-of-all-trades line of work are Shinpachi Shimura, a boy with glasses and a strong heart, Kagura with her umbrella and seemingly bottomless stomach, as well as Sadaharu, their oversized pet dog. Of course, these odd jobs are not always simple, as they frequently have run-ins with the police, ragtag rebels, and assassins, oftentimes leading to humorous but unfortunate consequences.\n\r\nWho said life as an errand boy was easy?\n\r\n[Written by MAL Rewrite]']",https://cdn.myanimelist.net/images/anime/10/73274.jpg,,https://myanimelist.net/anime/918/Gintama
Gintama Movie 2: Kanketsu-hen - Yorozuya yo Eien Nare,Movie,1.0,197426.0,111621.0,8.94,"['Action', 'Comedy', 'Sci-Fi', 'Historical', 'Parody', 'Samurai', 'Shounen']",        Jul 2013 - Jul 2013,"['When Gintoki apprehends a movie pirate at a premiere, he checks the camera\'s footage and finds himself transported to a bleak, post-apocalyptic version of Edo, where a mysterious epidemic called the ""White Plague"" has ravished the world\'s population. It turns out that the movie pirate wasn\'t a pirate after all—it was an android time machine, and Gintoki has been hurtled five years into the future! Shinpachi and Kagura, his Yorozuya cohorts, have had a falling out and are now battle-hardened solo vigilantes and he himself has been missing for years, disappearing without a trace after scribbling a strange message in his journal.\n\r\nSetting out in the disguise given to him by the android time machine, Gintoki haphazardly reunites the Yorozuya team to investigate the White Plague, and soon discovers that the key to saving the future lies in the darkness of his own past. Determined to confront a powerful foe, he makes an important discovery—with a ragtag band of friends and allies at his side, he doesn\'t have to fight alone.\n\r\n[Written by MAL Rewrite]']",https://cdn.myanimelist.net/images/anime/10/51723.jpg,,https://myanimelist.net/anime/15335/Gintama_Movie_2__Kanketsu-hen_-_Yorozuya_yo_Eien_Nare
Code Geass: Hangyaku no Lelouch R2,TV,25.0,1477784.0,991039.0,8.91,"['Action', 'Drama', 'Sci-Fi', 'Mecha', 'Military', 'SuperPower']",        Apr 2008 - Sep 2008,"[""One year has passed since the Black Rebellion, a failed uprising against the Holy Britannian Empire led by the masked vigilante Zero, who is now missing. At a loss without their revolutionary leader, Area 11's resistance group—the Black Knights—find themselves too powerless to combat the brutality inflicted upon the Elevens by Britannia, which has increased significantly in order to crush any hope of a future revolt. \n\r\nLelouch Lamperouge, having lost all memory of his double life, is living peacefully alongside his friends as a high school student at Ashford Academy. His former partner C.C., unable to accept this turn of events, takes it upon herself to remind him of his past purpose, hoping that the mastermind Zero will rise once again to finish what he started, in this thrilling conclusion to the series.\n\r\n[Written by MAL Rewrite]""]",https://cdn.myanimelist.net/images/anime/4/9391.jpg,Code Geass: Lelouch of the Rebellion R2,https://myanimelist.net/anime/2904/Code_Geass__Hangyaku_no_Lelouch_R2
Owarimonogatari 2nd Season,TV,7.0,323843.0,152042.0,8.91,"['Comedy', 'Mystery', 'Supernatural', 'Vampire']",        Aug 2017 - Aug 2017,"['Following an encounter with oddity specialist Izuko Gaen, third-year high school student Koyomi Araragi wakes up in a strange, deserted void only to be greeted by a joyfully familiar face in an alarmingly unfamiliar place.  \n\r\nAraragi, with the help of his girlfriend Hitagi Senjougahara, maneuvers through the webs of his past and the perplexities of the present in search of answers. However, fate once again delivers him to the eccentric transfer student Ougi Oshino, who brings forth an unexpected proposal that may unearth the very foundation to which he is anchored. As Araragi peels back the layers of mystery surrounding an apparition, he discovers a truth not meant to be revealed.\n\r\n[Written by MAL Rewrite]']",https://cdn.myanimelist.net/images/anime/6/87322.jpg,Owarimonogatari Second Season,https://myanimelist.net/anime/35247/Owarimonogatari_2nd_Season
Shingeki no Kyojin: The Final Season,TV,16.0,1352197.0,812495.0,8.9,"['Action', 'Drama', 'Fantasy', 'Mystery', 'Military', 'SuperPower', 'Shounen']",        Dec 2020 - Mar 2021,"[""Gabi Braun and Falco Grice have been training their entire lives to inherit one of the seven titans under Marley's control and aid their nation in eradicating the Eldians on Paradis. However, just as all seems well for the two cadets, their peace is suddenly shaken by the arrival of Eren Yeager and the remaining members of the Survey Corps.\n\r\nHaving finally reached the Yeager family basement and learned about the dark history surrounding the titans, the Survey Corps has at long last found the answer they so desperately fought to uncover. With the truth now in their hands, the group set out for the world beyond the walls.\n\r\nIn Shingeki no Kyojin: The Final Season, two utterly different worlds collide as each party pursues its own agenda in the long-awaited conclusion to Paradis' fight for freedom.\n\r\n[Written by MAL Rewrite]""]",https://cdn.myanimelist.net/images/anime/1000/110531.jpg,Attack on Titan: The Final Season,https://myanimelist.net/anime/40028/Shingeki_no_Kyojin__The_Final_Season
Kimi no Na wa.,Movie,1.0,2165852.0,1498465.0,8.89,"['Drama', 'Romance', 'Supernatural', 'School']",        Aug 2016 - Aug 2016,"[""Mitsuha Miyamizu, a high school girl, yearns to live the life of a boy in the bustling city of Tokyo—a dream that stands in stark contrast to her present life in the countryside. Meanwhile in the city, Taki Tachibana lives a busy life as a high school student while juggling his part-time job and hopes for a future in architecture.\n\r\nOne day, Mitsuha awakens in a room that is not her own and suddenly finds herself living the dream life in Tokyo—but in Taki's body! Elsewhere, Taki finds himself living Mitsuha's life in the humble countryside. In pursuit of an answer to this strange phenomenon, they begin to search for one another.\n\nKimi no Na wa. revolves around Mitsuha and Taki's actions, which begin to have a dramatic impact on each other's lives, weaving them into a fabric held together by fate and circumstance.\n\r\n[Written by MAL Rewrite]""]",https://cdn.myanimelist.net/images/anime/5/87048.jpg,Your Name.,https://myanimelist.net/anime/32281/Kimi_no_Na_wa
