name,type,episodes,members,score_members,rating,genre,dates,Description,Image-SRC,english_name,url
Fate/stay night Movie: Heaven's Feel - I. Presage Flower,Movie,1.0,353956.0,185216.0,8.21,"['Action', 'Fantasy', 'Supernatural']",        Oct 2017 - Oct 2017,"[""The Holy Grail War: a violent battle between mages in which seven masters and their summoned servants fight for the Holy Grail, a magical artifact that can grant the victor any wish. Nearly 10 years ago, the final battle of the Fourth Holy Grail War wreaked havoc on Fuyuki City and took over 500 lives, leaving the city devastated. \n\r\nShirou Emiya, a survivor of this tragedy, aspires to become a hero of justice like his rescuer and adoptive father, Kiritsugu Emiya. Despite only being a student, Shirou is thrown into the Fifth Holy Grail War when he accidentally sees a battle between servants at school and summons his own servant, Saber. \n\r\nWhen a mysterious shadow begins a murderous spree in Fuyuki City, Shirou aligns himself with Rin Toosaka, a fellow participant in the Holy Grail War, in order to stop the deaths of countless people. However, Shirou's feelings for his close friend Sakura Matou lead him deeper into the dark secrets surrounding the war and the feuding families involved.\n\r\n[Written by MAL Rewrite]""]",https://cdn.myanimelist.net/images/anime/1274/102213.jpg,Fate/stay night: Heaven's Feel - I. Presage Flower,https://myanimelist.net/anime/25537/Fate_stay_night_Movie__Heavens_Feel_-_I_Presage_Flower
Horimiya,TV,13.0,843216.0,462374.0,8.21,"['Comedy', 'Romance', 'SliceofLife', 'School', 'Shounen']",        Jan 2021 - Apr 2021,"[""On the surface, the thought of Kyouko Hori and Izumi Miyamura getting along would be the last thing in people's minds. After all, Hori has a perfect combination of beauty and brains, while Miyamura appears meek and distant to his fellow classmates. However, a fateful meeting between the two lays both of their hidden selves bare. Even though she is popular at school, Hori has little time to socialize with her friends due to housework. On the other hand, Miyamura lives under the noses of his peers, his body bearing secret tattoos and piercings that make him look like a gentle delinquent.\n\r\nHaving opposite personalities yet sharing odd similarities, the two quickly become friends and often spend time together in Hori's home. As they both emerge from their shells, they share with each other a side of themselves concealed from the outside world.\n\r\n[Written by MAL Rewrite]""]",https://cdn.myanimelist.net/images/anime/1695/111486.jpg,,https://myanimelist.net/anime/42897/Horimiya
InuYasha: Kanketsu-hen,TV,26.0,241011.0,119258.0,8.21,"['Action', 'Adventure', 'Comedy', 'Fantasy', 'Romance', 'Supernatural', 'Demons', 'Historical', 'Shounen']",        Oct 2009 - Mar 2010,"['Thwarted again by Naraku, Inuyasha, Kagome Higurashi, and their friends must continue their hunt for the few remaining Shikon Jewel shards, lest they fully form into a corrupted jewel at the hands of Naraku. But Naraku has plans of his own to acquire them, and will destroy anyone and anything standing in his way—even his own underlings.\n\r\nThe persistent, unyielding danger posed by Naraku forces Sango and Miroku to decide what is most important to them—each other or their duty in battle. Meanwhile, Inuyasha must decide whether his heart lies with Kikyou or Kagome, before fate decides for him. Amid the race to find the shards, Inuyasha and his brother Sesshoumaru must also resolve their feud and cooperate for their final confrontation with Naraku, as it is a battle they must win in order to put a stop to his evil and cruelty once and for all.\n\r\n[Written by MAL Rewrite]']",https://cdn.myanimelist.net/images/anime/7/75570.jpg,InuYasha: The Final Act,https://myanimelist.net/anime/6811/InuYasha__Kanketsu-hen
Kaguya-hime no Monogatari,Movie,1.0,178214.0,90859.0,8.21,"['Fantasy', 'Historical']",        Nov 2013 - Nov 2013,"[""Deep in the countryside, a man named Okina works as a bamboo cutter in a forest, chopping away at the hollow plants day after day. One day, he discovers a small baby inside a glowing shoot. He immediately takes her home, convinced that she is a princess sent to Earth as a divine blessing from heaven. Okina and his wife Ouna take it upon themselves to raise the infant as their own, watching over her as she quickly grows into an energetic young girl. Given the name Kaguya, she fits right in with the village she has come to call home, going on adventures with the other children and enjoying what youth has to offer.\n\r\nBut when Okina finds a large fortune of gold and treasure in the forest, Kaguya's life is completely changed. Believing this to be yet another gift from heaven, he takes it upon himself to turn his daughter into a real princess using the wealth he has just obtained, relocating the family to a mansion in the capital. As she leaves her friends behind to enter into an unwanted life of royalty, Kaguya's origins and purpose slowly come to light.\n\r\n[Written by MAL Rewrite]""]",https://cdn.myanimelist.net/images/anime/1935/93606.jpg,The Tale of the Princess Kaguya,https://myanimelist.net/anime/16664/Kaguya-hime_no_Monogatari
Little Busters!: Refrain,TV,13.0,147356.0,68815.0,8.21,"['Comedy', 'Drama', 'Romance', 'SliceofLife', 'Supernatural', 'School']",        Oct 2013 - Dec 2013,"['Following the Little Busters after they lost their first baseball game, the team decides to have a pancake party. It has been almost one semester since the return of Kyousuke Natsume. As usual, Riki Naoe continues to help the Little Busters\' members—both old and new—with confronting their inner struggles. However, strange happenings begin to occur, leading Rin Natsume and Riki closer to unraveling the truth behind the ""secret of this world.""\n\r\nLittle do Rin and Rikki know, their discovery will end up changing the peaceful everyday lives created by the Little Busters once and for all. Little Busters!: Refrain brings a conclusion to the colorful stories of its ensemble cast—forged with the weight of emotions and strengthened with the bond of friendship—as they come to terms with their regrets and weaknesses.\n\r\n[Written by MAL Rewrite]']",https://cdn.myanimelist.net/images/anime/10/55049.jpg,Little Busters! ~Refrain~,https://myanimelist.net/anime/18195/Little_Busters__Refrain
Major S4,TV,26.0,58167.0,36238.0,8.21,"['Comedy', 'Drama', 'Sports', 'Shounen']",        Jan 2008 - Jun 2008,"['Having finished high school, Gorou Honda sets his sights on becoming a professional baseball player. His dreams are much more ambitious than becoming a Japanese Baseball League player, so he instead decides to move to the birthplace of his beloved sport, America, in order to play in the Major League.\n\r\nHowever, Gorou finds that the Major League players are much faster, stronger, and more driven than he is. Nonetheless, he is eager to catch up with them. In order to do so, Gorou must first conquer the ranks of the Minor League, where numerous skilled players compete in the grueling rise to the Majors.\n\r\nGorou learns that he will have to adapt to the stark differences of American culture and push himself to new extremes as his race to join the Major League begins.\n\r\n[Written by MAL Rewrite]']",https://cdn.myanimelist.net/images/anime/9/75217.jpg,,https://myanimelist.net/anime/3226/Major_S4
Nomad: Megalo Box 2,TV,13.0,148482.0,49148.0,8.21,"['Action', 'Drama', 'Sci-Fi', 'Sports']",        Apr 2021 - Jun 2021,"['Megalo Box is an advanced form of boxing where competitors wear metal frames called Gear. When the first ever Megalonia tournament took place, ""Gearless"" Joe became its champion and known to all as a legendary fighter. However, soon after, he lost an exhibition match against the second champion and vanished from the public eye.\n\r\nSeven years later, Joe now goes by ""Nomad"" and keeps a low profile, occasionally fighting in a few underground matches to get by. He is haunted by hallucinations and relies on a set of painkillers to numb his mind.\n\r\nDuring a match, Joe wins against an opponent, Chief, who purposefully loses for some extra cash from gamblers. Subsequently, Joe discovers that Chief is from a community of immigrants called the Casa. Chief is gradually trying to make enough money to purchase the land where they live illegally. At first, Joe hesitates to get involved, but eventually decides to lend the Casa a helping hand.\n\r\n[Written by MAL Rewrite]']",https://cdn.myanimelist.net/images/anime/1190/113352.jpg,,https://myanimelist.net/anime/40729/Nomad__Megalo_Box_2
ReLIFE: Kanketsu-hen,Special,4.0,298075.0,176312.0,8.21,"['Romance', 'SliceofLife', 'School']",        Mar 2018 - Mar 2018,"['After reliving the life of a high school student through the ReLIFE experiment, 27-year-old Arata Kaizaki cannot believe how quickly it has changed him. He has begun to see the world through a different perspective that he had completely forgotten as an adult. He has made friends and formed deep relationships with each one of them. However his support, Ryou Yoake, reminds him that the experiment is all an illusion; after his experiment ends, he will be forgotten by all of them.\n\r\nThe experiment of another ReLIFE subject is also coming to an end. After spending two years with ReLIFE, Chizuru Hishiro has developed into a more open, more thoughtful person than she could have ever imagined. She has met people who have changed her life, her perspective, and ultimately her. However, now that their ReLIFE is coming to an end, will they be able to let go of the memories they have made?\n\r\n[Written by MAL Rewrite]']",https://cdn.myanimelist.net/images/anime/1566/91061.jpg,,https://myanimelist.net/anime/35466/ReLIFE__Kanketsu-hen
Saiki Kusuo no Ψ-nan: Kanketsu-hen,Special,1.0,159968.0,95188.0,8.21,"['Comedy', 'SliceofLife', 'Supernatural', 'School', 'Shounen']",        Dec 2018 - Dec 2018,['Adaptation of the final chapters of the Saiki Kusuo no Ψ-nan manga.'],https://cdn.myanimelist.net/images/anime/1159/95661.jpg,The Disastrous Life of Saiki K. Final Arc,https://myanimelist.net/anime/38249/Saiki_Kusuo_no_Ψ-nan__Kanketsu-hen
Shokugeki no Souma,TV,24.0,1393372.0,830392.0,8.21,"['Gourmet', 'Ecchi', 'School', 'Shounen']",        Apr 2015 - Sep 2015,"['Ever since he was a child, fifteen-year-old Souma Yukihira has helped his father by working as the sous chef in the restaurant his father runs and owns. Throughout the years, Souma developed a passion for entertaining his customers with his creative, skilled, and daring culinary creations. His dream is to someday own his family\'s restaurant as its head chef.\n\r\nYet when his father suddenly decides to close the restaurant to test his cooking abilities in restaurants around the world, he sends Souma to Tootsuki Culinary Academy, an elite cooking school where only 10 percent of the students graduate. The institution is famous for its ""Shokugeki"" or ""food wars,"" where students face off in intense, high-stakes cooking showdowns.\n\r\nAs Souma and his new schoolmates struggle to survive the extreme lifestyle of Tootsuki, more and greater challenges await him, putting his years of learning under his father to the test.\n\r\n[Written by MAL Rewrite]']",https://cdn.myanimelist.net/images/anime/3/72943.jpg,Food Wars! Shokugeki no Soma,https://myanimelist.net/anime/28171/Shokugeki_no_Souma
Toaru Kagaku no Railgun T,TV,25.0,179038.0,64683.0,8.21,"['Action', 'Sci-Fi', 'SuperPower']",        Jan 2020 - Sep 2020,"['The Daihasei Festival has begun, and that of course means that Tokiwadai Middle School—a prestigious all-girls\' middle school—is competing too. Despite the participation of the ""Ace of Tokiwadai,"" Mikoto Misaka, the other students who are participating are still putting their utmost effort into winning, no matter how impossible the feat may seem against her might.\n\r\nHowever, not all is fun and games. Due to the festival, Academy City opens to the outside world, and various factions have begun plotting ways to infiltrate the city. Misaka appears to be on their radar, and as the festival proceeds, people lurking from the shadows begin to emerge...\n\nToaru Kagaku no Railgun T brings back the Tokiwadai Ace and her friends as they dive deeper into the dark side of Academy City. From terrorist attacks to ruthless underground projects, anything is possible in this city.\n\r\n[Written by MAL Rewrite]']",https://cdn.myanimelist.net/images/anime/1819/103287.jpg,A Certain Scientific Railgun T,https://myanimelist.net/anime/38481/Toaru_Kagaku_no_Railgun_T
xxxHOLiC: Rou,OVA,2.0,61887.0,28879.0,8.21,"['Mystery', 'Supernatural']",        Apr 2010 - Mar 2011,"[""10 years after the events of xxxHOLiC Shunmuki, a melancholic Kimihiro Watanuki has taken over the shop formerly run by the mysterious Yuuko due to a promise he made to her. His companions Maru, Moro, and Mokona live together with him in relative contentment, and some familiar faces arrive every now and then: former rival turned-steadfast friend Shizuka Doumeki, and the former psychic prodigy Kohane Tsuyuri. While Kohane studies folklore under Doumeki at university, they encounter a case that is perfect for the master of the shop.\n\r\nEventually, Watanuki receives a visit from Doumeki's grandfather, Haruka. He requests that Watanuki investigates his grandson's dreams. While inside the dream world, he discovers how their past adventures played out from Doumeki's perspective of view, leading Watanuki to discover truths from 10 years ago and secrets about the ties that bind their friendship.\n\r\n[Written by MAL Rewrite]""]",https://cdn.myanimelist.net/images/anime/9/25080.jpg,,https://myanimelist.net/anime/6864/xxxHOLiC__Rou
Yoru wa Mijikashi Arukeyo Otome,Movie,1.0,96315.0,38543.0,8.21,"['Comedy', 'Romance']",        Apr 2017 - Apr 2017,"['On a mysterious night that seems to last for a year, an ordinary college student continues to chase one of his underclassmen, a girl with black hair—the girl of his dreams. Up until now, he has been relying on a simple plan, which is to calculatingly bump into her every day while making it seem like a meaningful coincidence. However, his efforts remain futile as their relationship is not progressing at all.\n\r\nMeanwhile, the black-haired girl believes that everything is connected by fate and endeavors to experience as many new things as possible, leaving it all for destiny to decide. While strolling along the lively streets of Kyoto, she discovers that the very beginning of her fateful journey—a book she had as a child—is currently being sold in a second-hand bookstore. Upon knowing this, the college student eyes another opportunity to run into her ""by chance"": this time, he hopes to get the book before she does and finally grasp the thread of fate that could connect their hearts.\n\r\n[Written by MAL Rewrite]']",https://cdn.myanimelist.net/images/anime/2/86940.jpg,"The Night Is Short, Walk on Girl",https://myanimelist.net/anime/34537/Yoru_wa_Mijikashi_Arukeyo_Otome
One Piece: Episode of Merry - Mou Hitori no Nakama no Monogatari,Special,1.0,50084.0,25716.0,8.2,"['Action', 'Adventure', 'Comedy', 'Drama', 'Fantasy', 'SuperPower', 'Shounen']",        Aug 2013 - Aug 2013,"[""The story arcs aboard the Straw Hat Crew's first ship Going Merry (Merry Go in some adaptations) are recreated with brand-new animation, from Luffy and Usopp's fight and Robin's disappearance to the crew's final farewell to the ship. Going Merry is treated as another member of the Straw Hats as Luffy, Zoro, Nami, and the rest of the crew set sail for the legendary treasure, the One Piece.\n\r\n(Source: ANN)""]",https://cdn.myanimelist.net/images/anime/9/61015.jpg,,https://myanimelist.net/anime/19123/One_Piece__Episode_of_Merry_-_Mou_Hitori_no_Nakama_no_Monogatari
86,TV,11.0,401329.0,174070.0,8.2,"['Action', 'Drama', 'Sci-Fi', 'Mecha', 'Military']",        Apr 2021 - Jun 2021,"['According to the Republic of San Magnolia, their ongoing war against the Giadian Empire has no casualties—however, that is mere propaganda. While the silver-haired Alba of the Republic\'s eighty-five sectors live safely behind protective walls, those of different appearances are interned in a secret eighty-sixth faction. Known within the military as the Eighty-Six, they are forced to fight against the Empire\'s autonomous Legion under the command of the Republican ""Handlers.""\n\r\nVladilena Milizé is assigned to the Spearhead squadron to replace their previous Handler. Shunned by her peers for being a fellow Eighty-Six supporter, she continues to fight against their inhumane discrimination. Shinei Nouzen is the captain of the Spearhead squadron. Infamous for being the sole survivor of every squadron he\'s been in, he insists on shouldering the names and wishes of his fallen comrades. When the fates of these young souls from two different worlds collide, will it ignite the spark that lights their path to salvation, or will they burn themselves in the flames of despair?\n\r\n[Written by MAL Rewrite]']",https://cdn.myanimelist.net/images/anime/1987/117507.jpg,,https://myanimelist.net/anime/41457/86
Ballroom e Youkoso,TV,24.0,268272.0,115736.0,8.2,"['Comedy', 'Drama', 'Romance', 'Sports', 'School', 'Shounen']",        Jul 2017 - Dec 2017,"[""Tatara Fujita is a shy middle schooler who has no particular plan for the future. He has gotten through life by avoiding any kind of confrontation and blending in with the crowd. But blending in isn't enough to get out of trouble, as some bullies harass him for money. Luckily, he is saved by a man named Kaname Sengoku.\n\r\nKaname invites Tatara to his dance studio. Although he would normally never set foot in such a place, Tatara is captivated by Sengoku's commanding presence. Granted an opportunity to dance with fellow classmate Shizuku Hanaoka—who often practices at the studio—Tatara realizes there's something about the idea of being put in the limelight and dancing where people will see him that keeps him coming back. With an earnest, passionate drive to improve, Tatara begins his journey into the world of competitive dance.\n\r\n[Written by MAL Rewrite]""]",https://cdn.myanimelist.net/images/anime/5/86739.jpg,Welcome to the Ballroom,https://myanimelist.net/anime/34636/Ballroom_e_Youkoso
Berserk: Ougon Jidai-hen III - Kourin,Movie,1.0,181329.0,114590.0,8.2,"['Action', 'Adventure', 'Drama', 'Fantasy', 'Horror', 'Supernatural', 'Demons', 'Military', 'Seinen']",        Feb 2013 - Feb 2013,"[""The Band of the Hawk has dwindled in the year since Guts left them on his journey to forge his own destiny. Unaware of their fate, Guts returns to the Hawks—now being led by his former ally Casca—after a rumor about them passes his way. Once the saviors of the kingdom of Midland, the Band of the Hawk are now hunted as they desperately fight for their lives while plotting to free their leader, Griffith, after he was imprisoned for committing treason. But the man they save is far from the Griffith they remember.\n\r\nGriffith is a shell of his former charismatic self after a year of continuous, horrific torture. No longer able to walk, speak, or even hold a sword, he has nothing but the small, strange trinket, the Crimson Behelit, that will not leave him. The entire Band of the Hawk want to rise to greatness once more, but how much are they willing to sacrifice to return to their past glory? It doesn't seem possible, but when Griffith's heart darkens and a solar eclipse blackens the sky, the Behelit offers a choice that will leave the Band of the Hawk with a blood-soaked fate that will haunt them for the rest of their days.\n\r\n[Written by MAL Rewrite]""]",https://cdn.myanimelist.net/images/anime/12/41305.jpg,Berserk: The Golden Age Arc III - The Advent,https://myanimelist.net/anime/12115/Berserk__Ougon_Jidai-hen_III_-_Kourin
Boku no Hero Academia 2nd Season,TV,25.0,2038685.0,1385309.0,8.2,"['Action', 'Comedy', 'School', 'SuperPower', 'Shounen']",        Apr 2017 - Sep 2017,"['At UA Academy, not even a violent attack can disrupt their most prestigious event: the school sports festival. Renowned across Japan, this festival is an opportunity for aspiring heroes to showcase their abilities, both to the public and potential recruiters.\n\r\nHowever, the path to glory is never easy, especially for Izuku Midoriya—whose quirk possesses great raw power but is also cripplingly inefficient. Pitted against his talented classmates, such as the fire and ice wielding Shouto Todoroki, Izuku must utilize his sharp wits and master his surroundings to achieve victory and prove to the world his worth.\n\r\n[Written by MAL Rewrite]']",https://cdn.myanimelist.net/images/anime/12/85221.jpg,My Hero Academia 2,https://myanimelist.net/anime/33486/Boku_no_Hero_Academia_2nd_Season
Bungou Stray Dogs 2nd Season,TV,12.0,633167.0,357180.0,8.2,"['Action', 'Mystery', 'Supernatural', 'SuperPower', 'Seinen']",        Oct 2016 - Dec 2016,"[""Despite their differences in position, three men—the youngest senior executive of the Port Mafia, Osamu Dazai; the lowest ranking member, Sakunosuke Oda; and the intelligence agent, Angou Sakaguchi—gather at the Lupin Bar at the end of the day to relax and take delight in the company of friends.\n\r\nHowever, one night, Ango disappears. A photograph taken at the bar is all that is left of the three together.\n\r\nFast forward to the present, and Dazai is now a member of the Armed Detective Agency. The Guild, an American gifted organization, has entered the fray and is intent on taking the Agency's work permit. They must now divide their attention between the two groups, the Guild and the Port Mafia, who oppose their very existence.   \n\r\n[Written by MAL Rewrite]""]",https://cdn.myanimelist.net/images/anime/5/88585.jpg,Bungo Stray Dogs 2,https://myanimelist.net/anime/32867/Bungou_Stray_Dogs_2nd_Season
Bungou Stray Dogs 3rd Season,TV,12.0,430101.0,215562.0,8.2,"['Action', 'Mystery', 'Supernatural', 'SuperPower', 'Seinen']",        Apr 2019 - Jun 2019,"[""Following the conclusion of the three-way organizational war, government bureaucrat Ango Sakaguchi recalls an event that transpired years ago, after the death of the former Port Mafia boss. Osamu Dazai, still a new recruit at the time, was tasked with investigating rumors related to a mysterious explosion that decimated part of the city years ago—and its connection to the alleged reappearance of the former boss.\n\r\nDue to circumstances out of his control, he is partnered with Chuuya Nakahara, the gifted yet impulsive leader of a rival clan known as the ''Sheep,'' to uncover the truth behind the case and shine a light on the myth of Arahabaki—the god of fire who might just lead Dazai to the case's solution.\n\r\nMeanwhile, in the present day, it is business as usual once again for the Armed Detective Agency. Their peaceful break will not last for long, however, as enemies old and new gather their strength and prepare for another face-off.\n\r\n[Written by MAL Rewrite]""]",https://cdn.myanimelist.net/images/anime/1037/100463.jpg,,https://myanimelist.net/anime/38003/Bungou_Stray_Dogs_3rd_Season
Cardcaptor Sakura Movie 2: Fuuin Sareta Card,Movie,1.0,103269.0,60442.0,8.2,"['Comedy', 'Drama', 'Fantasy', 'Romance', 'Shoujo']",        Jul 2000 - Jul 2000,"['For this year\'s Nadeshiko Festival, Sakura Kinomoto\'s elementary school class is presenting a play. She will portray a princess who struggles to respond to the love confession of the neighboring country\'s prince. Sakura empathizes with her character all too well, since she herself still owes an answer to the boy who confessed his love for her four months ago.\n\r\nWhen cousins Shaoran and Meiling Li return from Hong Kong to pay a surprise visit to their friends in Japan, Sakura receives further encouragement to finally declare her feelings. However, she is repeatedly distracted by a presence reminiscent of a Clow Card as well as unexplained disappearances around town.\n\r\nEventually, Sakura learns of another of Clow Reed\'s creations—the ""Nothing""—which was formerly sealed away beneath the magician\'s old house. It has power equal to all 52 cards Sakura possesses, and furthermore, it wants to take those cards away from her! Objects, space, and people disappear from Tomoeda with each card that is stolen. Sakura sets out to capture the Nothing so everything will return to normal, but what must she sacrifice in the process?\n\r\n[Written by MAL Rewrite]']",https://cdn.myanimelist.net/images/anime/1652/90326.jpg,Card Captor Sakura Movie 2: The Sealed Card,https://myanimelist.net/anime/372/Cardcaptor_Sakura_Movie_2__Fuuin_Sareta_Card
Douluo Dalu: Qian Hua Xi Jin,ONA,13.0,5969.0,3092.0,8.2,"['Action', 'Adventure', 'Fantasy', 'Romance', 'Historical', 'MartialArts']",        Feb 2020 - May 2020,['Fourth part of Douluo Dalu.'],https://cdn.myanimelist.net/images/anime/1595/113994.jpg,,https://myanimelist.net/anime/42497/Douluo_Dalu__Qian_Hua_Xi_Jin
