name,type,episodes,members,score_members,rating,genre,dates,Description,Image-SRC,english_name,url
Yakusoku no Neverland,TV,12.0,1528435.0,980031.0,8.57,"['Horror', 'Mystery', 'Sci-Fi', 'Suspense', 'Psychological', 'Shounen']",        Jan 2019 - Mar 2019,"['Surrounded by a forest and a gated entrance, the Grace Field House is inhabited by orphans happily living together as one big family, looked after by their ""Mama,"" Isabella. Although they are required to take tests daily, the children are free to spend their time as they see fit, usually playing outside, as long as they do not venture too far from the orphanage—a rule they are expected to follow no matter what. However, all good times must come to an end, as every few months, a child is adopted and sent to live with their new family, never to be heard from again.\n\r\nHowever, the three oldest siblings have their suspicions about what is actually happening at the orphanage, and they are about to discover the cruel fate that awaits the children living at Grace Field, including the twisted nature of their beloved Mama.\n\r\n[Written by MAL Rewrite]']",https://cdn.myanimelist.net/images/anime/1830/118780.jpg,The Promised Neverland,https://myanimelist.net/anime/37779/Yakusoku_no_Neverland
Mushishi: Hihamukage,Special,1.0,118628.0,57251.0,8.56,"['Adventure', 'Fantasy', 'Mystery', 'SliceofLife', 'Supernatural', 'Historical', 'Seinen']",        Jan 2014 - Jan 2014,"[""The entire countryside comes to a halt midday to witness a rare solar eclipse that is rumored to allow the average person to see Mushi. Unable to avert their gaze, the air is full of awe and wonder—but those who know the Mushi are preparing for the eclipse's aftermath.\n\r\nBased on a prediction from Tanyuu Karibusa, the cursed recorder, Mushishi Ginko finds himself in a very unlucky farming village. Immediately following the solar eclipse, a strange black cloud begins to gather in the sky and blocks the sun once more. Suspecting it to be the work of a Mushi known as Hihami, Ginko seeks to liberate the village from perpetual darkness. However, it seems that not all of the villagers are eager to return to the light.\n\r\n[Written by MAL Rewrite]""]",https://cdn.myanimelist.net/images/anime/10/59315.jpg,The Shadow that Devours the Sun,https://myanimelist.net/anime/21329/Mushishi__Hihamukage
Zoku Natsume Yuujinchou,TV,13.0,218711.0,109842.0,8.56,"['Drama', 'SliceofLife', 'Supernatural', 'Demons', 'Shoujo']",        Jan 2009 - Mar 2009,"['As with its prequel, Zoku Natsume Yuujinchou is about Takashi Natsume, a boy who has had the ability to see youkai since he was young, and his bodyguard youkai Madara, nicknamed Nyanko-sensei. Natsume attempts to return names written in his ""Book of Friends"" (which he inherited from his grandmother Reiko) to youkai in his village. Throughout these adventures, he meets some youkai that are friendly, some that want to steal the Book, and some that want to kill him, as Natsume learns about himself and his relationship with these mysterious beings along the way.\n\r\n[Written by MAL Rewrite]']",https://cdn.myanimelist.net/images/anime/4/79738.jpg,Natsume's Book of Friends Season 2,https://myanimelist.net/anime/5300/Zoku_Natsume_Yuujinchou
Bakuman. 3rd Season,TV,25.0,294749.0,171135.0,8.56,"['Comedy', 'Drama', 'Romance', 'Shounen']",        Oct 2012 - Mar 2013,"[""Onto their third serialization, manga duo Moritaka Mashiro and Akito Takagi—also known by their pen name, Muto Ashirogi—are ever closer to their dream of an anime adaption. However, the real challenge is only just beginning: if they are unable to compete with the artist Eiji Niizuma in the rankings within the span of six months, they will be canceled. To top it off, numerous rivals are close behind and declaring war. They don't even have enough time to spare thinking about an anime!\n\r\nIn Bakuman. 3rd Season, Muto Ashirogi must find a way to stay atop the colossal mountain known as the Shounen Jack rankings. With new problems and new assistants, the pair continue to strive for their dream.\n\r\n[Written by MAL Rewrite]""]",https://cdn.myanimelist.net/images/anime/6/41845.jpg,Bakuman.,https://myanimelist.net/anime/12365/Bakuman_3rd_Season
Fate/stay night Movie: Heaven's Feel - II. Lost Butterfly,Movie,1.0,285430.0,157495.0,8.55,"['Action', 'Fantasy', 'Supernatural']",        Jan 2019 - Jan 2019,"[""The Fifth Holy Grail War continues, and the ensuing chaos results in higher stakes for all participants. Shirou Emiya continues to participate in the war, aspiring to be a hero of justice who saves everyone. He sets out in search of the truth behind a mysterious dark shadow and its murder spree, determined to defeat it.\n\r\nMeanwhile, Shinji Matou sets his own plans into motion, threatening Shirou through his sister Sakura Matou. Shirou and Rin Toosaka battle Shinji, hoping to relieve Sakura from the abuses of her brother. But the ugly truth of the Matou siblings begins to surface, and many dark secrets are exposed.\n\nFate/stay night Movie: Heaven's Feel - II. Lost Butterfly continues to focus on the remaining Masters and Servants as they fight each other in the hopes of obtaining the Holy Grail. However, as darkness arises within Fuyuki City, even the state of their sacred war could be in danger.\n\r\n[Written by MAL Rewrite]""]",https://cdn.myanimelist.net/images/anime/1974/98158.jpg,Fate/stay night: Heaven's Feel - II. Lost Butterfly,https://myanimelist.net/anime/33049/Fate_stay_night_Movie__Heavens_Feel_-_II_Lost_Butterfly
Kara no Kyoukai 5: Mujun Rasen,Movie,1.0,208592.0,115522.0,8.55,"['Action', 'Drama', 'Mystery', 'Romance', 'Supernatural', 'Suspense']",        Aug 2008 - Aug 2008,"['In November 1998, a double homicide occurs at the newly constructed Ogawa apartment complex in the heart of Mifune City. The murderer, Tomoe Enjou, has fled in a panic. To his astonishment, he is not pursued by the police and news of the incident has not been reported through media outlets. After Shiki Ryougi defends Tomoe from a group of thugs, she allows him to use her residence as a hideout. However, a few days later, Tomoe is shaken to discover that his mother is alive, even though he is convinced that he killed her.\n\r\nCoincidentally, Mikiya Kokutou is investigating a tip that his associate Touko Aozaki receives regarding the murder at the unique apartment complex. As he uncovers more information about the incident, Mikiya takes a particular interest in Tomoe. Deciding to investigate him further, Mikiya soon discovers the disturbing truth of the foreboding Ogawa complex.\n\r\nThe fifth installment of the Kara no Kyoukai film series, Mujun Rasen combines an intricately constructed mystery with established themes and characters to produce a dark, thought-provoking story.\n\r\n[Written by MAL Rewrite]']",https://cdn.myanimelist.net/images/anime/1574/112838.jpg,the Garden of sinners Chapter 5: Paradox Paradigm,https://myanimelist.net/anime/4282/Kara_no_Kyoukai_5__Mujun_Rasen
Sora yori mo Tooi Basho,TV,13.0,405634.0,172116.0,8.55,"['Adventure', 'Comedy', 'Drama']",        Jan 2018 - Mar 2018,"[""Filled with an overwhelming sense of wonder for the world around her, Mari Tamaki has always dreamt of what lies beyond the reaches of the universe. However, despite harboring such large aspirations on the inside, her fear of the unknown and anxiety over her own possible limitations have always held her back from chasing them. But now, in her second year of high school, Mari is more determined than ever to not let any more of her youth go to waste. Still, her fear continues to prevent her from taking that ambitious step forward—that is, until she has a chance encounter with a girl who has grand dreams of her own.\n\r\nSpurred by her mother's disappearance, Shirase Kobuchizawa has been working hard to fund her trip to Antarctica. Despite facing doubt and ridicule from virtually everyone, Shirase is determined to embark on this expedition to search for her mother in a place further than the universe itself. Inspired by Shirase's resolve, Mari jumps at the chance to join her. Soon, their efforts attract the attention of the bubbly Hinata Miyake, who is eager to stand out, and Yuzuki Shiraishi, a polite girl from a high class background. Together, they set sail toward the frozen south.\n\nSora yori mo Tooi Basho follows the captivating journey of four spirited girls, all in search of something great.\n\r\n[Written by MAL Rewrite]""]",https://cdn.myanimelist.net/images/anime/6/89879.jpg,A Place Further Than The Universe,https://myanimelist.net/anime/35839/Sora_yori_mo_Tooi_Basho
Neon Genesis Evangelion: The End of Evangelion,Movie,1.0,722149.0,476287.0,8.54,"['AvantGarde', 'Drama', 'Sci-Fi', 'Mecha', 'Psychological']",        Jul 1997 - Jul 1997,"[""Shinji Ikari is left emotionally comatose after the death of a dear friend. With his son mentally unable to pilot the humanoid robot Evangelion Unit-01, Gendou Ikari's NERV races against the shadow organization SEELE to see who can enact their ultimate plan first. SEELE desires to create a godlike being by fusing their own souls into an Evangelion unit, while Gendou wishes to revert all of humanity into one primordial being so that he can be reunited with Yui, his deceased wife.\n\r\nSEELE unleashes its military forces in a lethal invasion of NERV headquarters. As SEELE's forces cut down NERV's scientists and security personnel, Asuka Langley Souryuu pilots Evangelion Unit-02 in a desperate last stand against SEELE's heaviest weaponry.\n\r\nThe battle rages on, and a depressed Shinji hides deep within NERV's headquarters. With the fate of the world resting in Shinji's hands, Captain Misato Katsuragi hunts for the teenage boy as society crumbles around them.\n\r\n[Written by MAL Rewrite]""]",https://cdn.myanimelist.net/images/anime/1404/98182.jpg,,https://myanimelist.net/anime/32/Neon_Genesis_Evangelion__The_End_of_Evangelion
Yuru Camp△ Season 2,TV,13.0,158302.0,55617.0,8.54,"['Comedy', 'SliceofLife']",        Jan 2021 - Apr 2021,"[""Having spent Christmas camping with her new friends, Rin Shima embarks on a solo-camping trip to see the New Year sunrise by the sea. All goes according to plan until unforeseen weather blocks the roads back home, making a return trip impossible. Rin, who is now stranded for a few days, is invited by Nadeshiko Kagamihara to stay at her grandmother's house. \n\r\nWhat is supposed to be a two-day trip becomes an extended period of sightseeing and new experiences for Rin, and she encounters some new and old faces along the way. Yuru Camp△ Season 2 continues the story of Rin, Nadeshiko, and their friends as they further explore the joys of camping.\n\r\n[Written by MAL Rewrite]""]",https://cdn.myanimelist.net/images/anime/1255/110636.jpg,Laid-Back Camp Season 2,https://myanimelist.net/anime/38474/Yuru_Camp△_Season_2
Haikyuu!!: To the Top 2nd Season,TV,12.0,566371.0,313528.0,8.54,"['Comedy', 'Drama', 'Sports', 'School', 'Shounen']",        Oct 2020 - Dec 2020,"['Once called a fallen powerhouse and known as ""Flightless Crows,"" Karasuno High School has finally taken flight at nationals. With a comprehensive performance against Tsubakihara Academy in their first match, the team is now facing its toughest opponent yet: the runners-up of the last Spring Tournament, Inarizaki High School. Furthermore, dealing with the formidable twin Miya brothers only makes things more difficult for Karasuno.\n\r\nAs soon as the match begins, Karasuno is overwhelmed by all the noise and jeers from the supporters of Inarizaki High but rekindles its strength thanks to its own loyal fans. Karasuno also gains some momentum by utilizing an attack centered on Shouyou Hinata, but the eccentric play of Atsumu and Osamu Miya delivers an unexpected blow that leaves their opponent astounded.\n\r\nThings are bound to get intense as the match progresses between these two teams. Will Karasuno be able to defeat Inarizaki High and overcome the hurdles that threaten its pursuit to the top?\n\r\n[Written by MAL Rewrite]']",https://cdn.myanimelist.net/images/anime/1453/106768.jpg,,https://myanimelist.net/anime/40776/Haikyuu__To_the_Top_2nd_Season
Gintama.: Porori-hen,TV,13.0,157609.0,76928.0,8.53,"['Action', 'Comedy', 'Sci-Fi', 'Historical', 'Parody', 'Samurai', 'Shounen']",        Oct 2017 - Dec 2017,"['Following the grim events of Iga, Kokujou Island, Rakuyou, and multiple fruitless confrontations with the Tenshouin Naraku and Tendoshuu, Gintama.: Porori-hen takes its viewers on a trip down memory lane to when Yorozuya were mostly doing what they did best—odd jobs. The great space hunter Umibouzu has returned to Edo and is livid when he finds out that his daughter Kagura has a boyfriend. He blames Gintoki for being an incompetent guardian, but has the time finally come for him to let go of his daughter?\n\r\nBack with shameless parodies, risqué humor, and lively camaraderie, Gintoki, Kagura, and Shinpachi are faced with unforeseen situations that manage to be both hilarious and emotionally stirring.\n\r\n[Written by MAL Rewrite]']",https://cdn.myanimelist.net/images/anime/11/88325.jpg,Gintama.: Slip Arc,https://myanimelist.net/anime/35843/Gintama__Porori-hen
Koukaku Kidoutai: Stand Alone Complex 2nd GIG,TV,26.0,204255.0,93307.0,8.53,"['Action', 'Mystery', 'Sci-Fi', 'Mecha', 'Military', 'Police', 'Seinen']",        Jan 2004 - Jan 2005,"['Following the closure of the ""Laughing Man"" case, Section 9 is re-established by Japan\'s newly elected Prime Minister, Youko Kayabuki, to combat the persistent threat of cyber-terrorism.\n\r\nA group calling themselves ""The Individual Eleven"" has begun committing acts of terror across Japan. While Motoko Kusanagi, Daisuke Aramaki, Batou, and the other members of Section 9 investigate this new menace, the Japanese government faces a separate crisis, as foreign refugees displaced by the Third World War seek asylum in Japan. But as the members of the special-ops team continually encounter Gouda Kazundo—a leading member of the Cabinet Intelligence Service—in their hunt, they begin to suspect that he may be involved, and that the events of the refugee crisis and The Individual Eleven may be more connected than they realize...\n\r\n[Written by MAL Rewrite]']",https://cdn.myanimelist.net/images/anime/1480/100555.jpg,Ghost in the Shell: Stand Alone Complex 2nd GIG,https://myanimelist.net/anime/801/Koukaku_Kidoutai__Stand_Alone_Complex_2nd_GIG
Slam Dunk,TV,101.0,237541.0,102933.0,8.53,"['Comedy', 'Drama', 'Sports', 'School', 'Shounen']",        Oct 1993 - Mar 1996,"['Hanamichi Sakuragi, infamous for his temper, massive height, and fire-red hair, enrolls in Shohoku High, hoping to finally get a girlfriend and break his record of being rejected 50 consecutive times in middle school. His notoriety precedes him, however, leading to him being avoided by most students. Soon, after certain events, Hanamichi is left with two unwavering thoughts: ""I hate basketball,"" and ""I desperately need a girlfriend.""\n\r\nOne day, a girl named Haruko Akagi approaches him without any knowledge of his troublemaking ways and asks him if he likes basketball. Hanamichi immediately falls head over heels in love with her, blurting out a fervent affirmative. She then leads him to the gymnasium, where she asks him if he can do a slam dunk. In an attempt to impress Haruko, he makes the leap, but overshoots, instead slamming his head straight into the blackboard. When Haruko informs the basketball team\'s captain of Hanamichi\'s near-inhuman physical capabilities, he slowly finds himself drawn into the camaraderie and competition of the sport he had previously held resentment for.\n\r\n[Written by MAL Rewrite]']",https://cdn.myanimelist.net/images/anime/12/86890.jpg,,https://myanimelist.net/anime/170/Slam_Dunk
One Punch Man,TV,12.0,2583068.0,1776669.0,8.52,"['Action', 'Comedy', 'Sci-Fi', 'Supernatural', 'Parody', 'SuperPower']",        Oct 2015 - Dec 2015,"[""The seemingly ordinary and unimpressive Saitama has a rather unique hobby: being a hero. In order to pursue his childhood dream, he trained relentlessly for three years—and lost all of his hair in the process. Now, Saitama is incredibly powerful, so much so that no enemy is able to defeat him in battle. In fact, all it takes to defeat evildoers with just one punch has led to an unexpected problem—he is no longer able to enjoy the thrill of battling and has become quite bored.\n\r\nThis all changes with the arrival of Genos, a 19-year-old cyborg, who wishes to be Saitama's disciple after seeing what he is capable of. Genos proposes that the two join the Hero Association in order to become certified heroes that will be recognized for their positive contributions to society, and Saitama, shocked that no one knows who he is, quickly agrees. And thus begins the story of One Punch Man, an action-comedy that follows an eccentric individual who longs to fight strong enemies that can hopefully give him the excitement he once felt and just maybe, he'll become popular in the process.\n\r\n[Written by MAL Rewrite]""]",https://cdn.myanimelist.net/images/anime/12/76049.jpg,,https://myanimelist.net/anime/30276/One_Punch_Man
Re:Zero kara Hajimeru Isekai Seikatsu 2nd Season Part 2,TV,12.0,608093.0,320418.0,8.52,"['Drama', 'Fantasy', 'Suspense', 'Psychological']",        Jan 2021 - Mar 2021,"[""After a stern yet compelling speech by Otto, Subaru Natsuki solemnly swears that he will successfully make it through this timeline and save everyone he can along the way. The first step toward achieving this goal is to help Emilia work through her past; however, that is easier said than done. Feeling as if she has been lied to by everyone around her, it will be difficult for Emilia to trust anyone, even Subaru, her self-proclaimed knight.\n\nRe:Zero kara Hajimeru Isekai Seikatsu 2nd Season Part 2 presents the culmination of Subaru's experiences with the Sanctuary and its people, along with his unwillingness to give up hope on saving them.\n\r\n[Written by MAL Rewrite]""]",https://cdn.myanimelist.net/images/anime/1724/117421.jpg,,https://myanimelist.net/anime/42203/Re_Zero_kara_Hajimeru_Isekai_Seikatsu_2nd_Season_Part_2
Shingeki no Kyojin,TV,25.0,3166638.0,2212814.0,8.52,"['Action', 'Drama', 'Fantasy', 'Mystery', 'Military', 'SuperPower', 'Shounen']",        Apr 2013 - Sep 2013,"[""Centuries ago, mankind was slaughtered to near extinction by monstrous humanoid creatures called titans, forcing humans to hide in fear behind enormous concentric walls. What makes these giants truly terrifying is that their taste for human flesh is not born out of hunger but what appears to be out of pleasure. To ensure their survival, the remnants of humanity began living within defensive barriers, resulting in one hundred years without a single titan encounter. However, that fragile calm is soon shattered when a colossal titan manages to breach the supposedly impregnable outer wall, reigniting the fight for survival against the man-eating abominations.\n\r\nAfter witnessing a horrific personal loss at the hands of the invading creatures, Eren Yeager dedicates his life to their eradication by enlisting into the Survey Corps, an elite military unit that combats the merciless humanoids outside the protection of the walls. Based on Hajime Isayama's award-winning manga, Shingeki no Kyojin follows Eren, along with his adopted sister Mikasa Ackerman and his childhood friend Armin Arlert, as they join the brutal war against the titans and race to discover a way of defeating them before the last walls are breached.\n\r\n[Written by MAL Rewrite]""]",https://cdn.myanimelist.net/images/anime/10/47347.jpg,Attack on Titan,https://myanimelist.net/anime/16498/Shingeki_no_Kyojin
Ansatsu Kyoushitsu 2nd Season,TV,25.0,1128149.0,688053.0,8.52,"['Action', 'Comedy', 'School', 'Shounen']",        Jan 2016 - Jul 2016,"[""The students return as school is back in session for the second semester. Following their exploits on the island during summer vacation, Class 3-E continues to sharpen their blades with their sights set on their teacher, the slippery Koro-sensei. They have more to worry about than just their teacher, however, as enemy assassins, both old and new, are out for the increased bounty on the octopus' head.\n\r\nMoreover, their rivals in Class A, as well as Kunugigaoka Junior High's fearsome principal, stand to block Class E from achieving academic excellence. With all of these obstacles opposing them, the group must continue to work together in order to overcome their foes and accomplish their goal of successfully assassinating their teacher.\n\r\n[Written by MAL Rewrite]""]",https://cdn.myanimelist.net/images/anime/8/77966.jpg,Assassination Classroom Second Season,https://myanimelist.net/anime/30654/Ansatsu_Kyoushitsu_2nd_Season
Gintama Movie 1: Shinyaku Benizakura-hen,Movie,1.0,135955.0,78113.0,8.52,"['Action', 'Comedy', 'Sci-Fi', 'Historical', 'Parody', 'Samurai', 'Shounen']",        Apr 2010 - Apr 2010,"[""Gintoki and his Yorozuya friends (or rather, employees suffering under labor violations), Shinpachi and Kagura, continue to scrape by in the futuristic, alien-infested city of Edo. They take on whatever work they can find while trying not to get involved in anything too dangerous. But when Katsura, the leader of the Joui rebels and Gintoki's long-time acquaintance, disappears after being brutally attacked by an unknown assassin, Shinpachi and Kagura begin an investigation into his whereabouts and the identity of the assailant. Meanwhile, Gintoki takes on a seemingly unrelated job: the blacksmith Tetsuya requests that Gin recover a strange and powerful sword called the Benizakura which was recently stolen.\n\r\nAs the two investigations gradually intersect, the Yorozuya crew find themselves in the midst of a major conspiracy that hinges on the sinister nature of the Benizakura sword. Gintoki resolves to take the fight directly to the enemy headquarters, and together with a few unexpected allies, sets out on one of his most perilous jobs yet.\n\r\n[Written by MAL Rewrite]""]",https://cdn.myanimelist.net/images/anime/4/28803.jpg,Gintama: The Movie,https://myanimelist.net/anime/7472/Gintama_Movie_1__Shinyaku_Benizakura-hen
Josee to Tora to Sakana-tachi,Movie,1.0,216664.0,93208.0,8.52,"['Drama', 'Romance', 'SliceofLife']",        Dec 2020 - Dec 2020,"['Equipped with his passion for diving and admiration for marine biology, university student Tsuneo Suzukawa tries his best to juggle several part-time jobs to earn enough money to study abroad. But one night, in a fateful accident, he meets a girl in a wheelchair, driving his current path into a detour.\n\r\nThe girl, Kumiko—who prefers to be called ""Josee""—initially comes off as rude. Tsuneo, however, is then convinced by Josee\'s grandmother to take on the paid job to be Josee\'s caretaker. Despite being annoyed with her bossy demeanor, Tsuneo sees the opportunity to save more funds to support his academic dream. Nonetheless, after putting up with Josee\'s behavior for some time, Tsuneo tries to quit, only to discover Josee\'s dreams of traversing the outside world—to experience a life free from her crippling condition.\n\r\nChanging his mind, Tsuneo decides to accompany Josee in exploring the wonders that the world has to offer. Through their time together, the two begin to realize that the traits that bind them may be vital toward fulfilling their respective aspirations.\n\r\n[Written by MAL Rewrite]']",https://cdn.myanimelist.net/images/anime/1714/108892.jpg,"Josee, the Tiger and the Fish",https://myanimelist.net/anime/40787/Josee_to_Tora_to_Sakana-tachi
Kenpuu Denki Berserk,TV,25.0,496767.0,258869.0,8.52,"['Action', 'Adventure', 'Drama', 'Fantasy', 'Horror', 'Supernatural', 'Demons', 'Military', 'Seinen']",        Oct 1997 - Apr 1998,"['Born from the corpse of his mother, a young mercenary known only as Guts embraces the battlefield as his only means of survival. Day in and day out, putting his life on the line just to make enough to get by, he moves from one bloodshed to the next.\n\r\nAfter a run-in with the Band of the Hawk, a formidable troop of mercenaries, Guts is recruited by their charismatic leader Griffith, nicknamed the ""White Hawk."" As he quickly climbed the ranks in order to become the head of the offensive faction, Guts proves to be a mighty addition to Griffith\'s force, taking Midland by storm. However, while the band\'s quest for recognition continues, Guts slowly realizes that the world is not as black-and-white as he once assumed.\n\r\nSet in the medieval era, Kenpuu Denki Berserk is a dark, gritty tale that follows one man\'s struggle to find his own path, while supporting another\'s lust for power, and the unimaginable tragedy that begins to turn the wheels of fate.\n\r\n[Written by MAL Rewrite]']",https://cdn.myanimelist.net/images/anime/12/18520.jpg,Berserk,https://myanimelist.net/anime/33/Kenpuu_Denki_Berserk
