name,type,episodes,members,score_members,rating,genre,dates,Description,Image-SRC,english_name,url
Uchuu Senkan Yamato 2199,OVA,26.0,100680.0,32969.0,8.35,"['Action', 'Drama', 'Sci-Fi', 'Military', 'Space']",        May 2012 - Oct 2013,"['In the year 2199, Earth faces its greatest crisis. Due to unrelenting bombings by the alien race known as ""Gamilas,"" the planet can no longer sustain its inhabitants. In exactly one year, humanity is set to become extinct.\n\r\nIn desperation, the people of Earth establish the Earth Defense Force, their last defense against the power-hungry Gamilas Empire. However, humanity finds a glimmer of hope after receiving a message from the mysterious planet Iscandar, which offers them a device that would restore Earth to its former glory. With salvation in sight, the Earth Defense Force calls on the prolific Space Battleship Yamato and swiftly assembles a crew to make the 168,000 light-year trek to Iscandar and receive their aid.\n\r\nAmong the crew are young officers Susumu Kodai and Daisuke Shima, along with several other newly promoted leaders, all under the command of the distinguished Captain Juuzou Okita. Forced to learn how to handle the ship\'s innovative technology while dealing with the onslaught of Gamilas fleets, the inexperienced cast of Uchuu Senkan Yamato 2199 must summon every inch of their resolve to survive the many hardships aboard the Yamato and complete their mission: to save humanity before it\'s too late.\n\r\n[Written by MAL Rewrite]']",https://cdn.myanimelist.net/images/anime/2/36607.jpg,Star Blazers: Space Battleship Yamato 2199,https://myanimelist.net/anime/12029/Uchuu_Senkan_Yamato_2199
Mobile Suit Gundam: The Origin,OVA,6.0,59318.0,21631.0,8.34,"['Action', 'Sci-Fi', 'Mecha', 'Military', 'Space', 'Shounen']",        Feb 2015 - May 2018,"['In the year 0068 of the Universal Century, Casval Rem Deikun\'s life is thrown into chaotic disarray after the assassination of his father, a prolific figure in the crusade towards civil rights for people who live away from the Earth\'s surface. Casval and his sister Artesia receive aid from soldiers who were loyal to their father, and the siblings are whisked away from their home, separated, and thrown into a twisted fate that sees them come into their own as soldiers and adults.\n\r\nYears before stealing the name Char Aznable or his ""Red Comet"" moniker, Casval must contend with the rise of a militarized version of his father\'s ideology and his own vengeful nature as intergalactic war molds him into a legendary mobile suit pilot.\n\r\n[Written by MAL Rewrite]']",https://cdn.myanimelist.net/images/anime/4/72702.jpg,,https://myanimelist.net/anime/10937/Mobile_Suit_Gundam__The_Origin
Natsume Yuujinchou: Itsuka Yuki no Hi ni,OVA,1.0,69607.0,30959.0,8.34,"['Drama', 'SliceofLife', 'Supernatural', 'Demons', 'Shoujo']",        Feb 2014 - Feb 2014,"[""During a winter walk, Natsume meets a snowman youkai who is searching for something she's lost and can't seem to recall and decides to help her despite not knowing what exactly she's looking for.""]",https://cdn.myanimelist.net/images/anime/11/79742.jpg,,https://myanimelist.net/anime/20651/Natsume_Yuujinchou__Itsuka_Yuki_no_Hi_ni
Neon Genesis Evangelion,TV,26.0,1429828.0,827903.0,8.34,"['Action', 'AvantGarde', 'Drama', 'Sci-Fi', 'Mecha', 'Psychological']",        Oct 1995 - Mar 1996,"['Fifteen years after a cataclysmic event known as the Second Impact, the world faces a new threat: monstrous celestial beings called ""Angels"" invade Tokyo-3 one by one. Mankind is unable to defend themselves against the Angels despite utilizing their most advanced munitions and military tactics. The only hope for human salvation rests in the hands of NERV, a mysterious organization led by the cold Gendou Ikari. NERV operates giant humanoid robots dubbed ""Evangelions"" to combat the Angels with state-of-the-art advanced weaponry and protective barriers known as Absolute Terror Fields.\n\r\nYears after being abandoned by his father, Shinji Ikari, Gendou\'s 14-year-old son, returns to Tokyo-3. Shinji undergoes a perpetual internal battle against the deeply buried trauma caused by the loss of his mother and the emotional neglect he suffered at the hands of his father. Terrified to open himself up to another, Shinji\'s life is forever changed upon meeting 29-year-old Misato Katsuragi, a high-ranking NERV officer who shows him a free-spirited maternal kindness he has never experienced.\n\r\nA devastating Angel attack forces Shinji into action as Gendou reveals his true motive for inviting his son back to Tokyo-3: Shinji is the only child capable of efficiently piloting Evangelion Unit-01, a new robot that synchronizes with his biometrics. Despite the brutal psychological trauma brought about by piloting an Evangelion, Shinji defends Tokyo-3 against the angelic threat, oblivious to his father\'s dark machinations.\n\r\n[Written by MAL Rewrite]']",https://cdn.myanimelist.net/images/anime/1314/108941.jpg,,https://myanimelist.net/anime/30/Neon_Genesis_Evangelion
One Outs,TV,25.0,204217.0,98167.0,8.34,"['Sports', 'Psychological', 'Seinen']",        Oct 2008 - Apr 2009,"['Toua Tokuchi is an athlete by profession, but a reckless gambler at heart. On the streets of Okinawa, he uses nothing but his wits and a ""fastball"" peaking at a mere 134 kmph to somehow achieve 499 wins in the game of ""One Outs,"" a simplified version of baseball between the pitcher and one batter. Amazed by Toua\'s unique prowess on the mound, veteran slugger Hiromichi Kojima artfully scouts the pitcher for his long unsuccessful team, the Saikyou Saitama Lycaons. Kojima desperately hopes Toua will lead them to the championship; however, Tsuneo Saikawa, the mercenary owner of the Lycaons, sees the vastly talented pitcher as a threat to the income generated by the team. Rising to the challenge of swaying the owner, Toua suggests a one-of-a-kind ""One Outs"" contract: every out Toua pitches will earn him five million yen, but with every run he gives up, he will lose fifty million yen.\n\r\nAdapted from the manga by Shinobu Kaitani of Liar Game fame, One Outs documents the intense psychological battles between Toua and those around him. With millions of yen at stake, can a pitcher who has done nothing but gamble in a head-to-head imitation of baseball finally lead a real baseball team to victory?\n\r\n[Written by MAL Rewrite]']",https://cdn.myanimelist.net/images/anime/7/21065.jpg,,https://myanimelist.net/anime/5040/One_Outs
Ookami to Koushinryou II,TV,12.0,431840.0,240525.0,8.34,"['Adventure', 'Fantasy', 'Romance', 'Historical']",        Jul 2009 - Sep 2009,"[""Traveling merchant Kraft Lawrence continues his northward journey with wolf goddess Holo, in search of her lost home of Yoitsu. Lawrence and his sharp-witted partner continue to make some small profits along the way, while slowly uncovering more information about Holo's hometown. However, the road to Yoitsu is a bumpy one filled with many troubles—Lawrence runs into a charming young fellow merchant who has his eyes set on the female wolf companion, and he begins to doubt if Holo will remain by his side; he and the goddess will also have to consider precarious and risky business deals as Lawrence strives to achieve his dream of becoming a shopowner. All the while, with his determination tested at every turn during his journey, Lawrence must question his relationship with Holo, take on business ventures, and ask himself whether it is time for him and Holo to go their separate ways.\n\r\n[Written by MAL Rewrite]""]",https://cdn.myanimelist.net/images/anime/6/59399.jpg,Spice and Wolf II,https://myanimelist.net/anime/5341/Ookami_to_Koushinryou_II
Tenki no Ko,Movie,1.0,704877.0,413904.0,8.34,"['Drama', 'Fantasy', 'Romance', 'SliceofLife']",        Jul 2019 - Jul 2019,"['Tokyo is currently experiencing rain showers that seem to disrupt the usual pace of everyone living there to no end. Amidst this seemingly eternal downpour arrives the runaway high school student Hodaka Morishima, who struggles to financially support himself—ending up with a job at a small-time publisher. At the same time, the orphaned Hina Amano also strives to find work to sustain herself and her younger brother.\n\r\nBoth fates intertwine when Hodaka attempts to rescue Hina from shady men, deciding to run away together. Subsequently, Hodaka discovers that Hina has a strange yet astounding power: the ability to call out the sun whenever she prays for it. With Tokyo\'s unusual weather in mind, Hodaka sees the potential of this ability. He suggests that Hina should become a ""sunshine girl""—someone who will clear the sky for people when they need it the most.\n\r\nThings begin looking up for them at first. However, it is common knowledge that power always comes with a hefty price...\n\r\n[Written by MAL Rewrite]']",https://cdn.myanimelist.net/images/anime/1880/101146.jpg,Weathering With You,https://myanimelist.net/anime/38826/Tenki_no_Ko
Versailles no Bara,TV,40.0,78386.0,22831.0,8.34,"['Drama', 'Romance', 'Historical', 'Military', 'Shoujo']",        Oct 1979 - Sep 1980,"['In 1755, Marie Antoinette is born in the royal family of Austria and raised in luxury. However, the fate of the future queen of France is set in stone—at the young age of 15, she has to leave her family and marry the crown prince of France.\n\r\nAt the same time in France, a girl is born in the family of the Commander of the Royal Guards. Upset at not having a male heir, her father decides to raise her as a man and names the girl Oscar. Oscar is trained from a young age to become the leader of the Royal Guards, but she is yet to discern that the will of the queen sometimes does not equal the good of the people.\n\r\nBased on the critically acclaimed manga by Riyoko Ikeda, Rose of Versailles depicts the fateful meeting of Marie Antoinette and Oscar, which is bound to influence history and change the life of the people facing the French Revolution as the clock ticks toward the end of the French royalty.\n\r\n[Written by MAL Rewrite]']",https://cdn.myanimelist.net/images/anime/9/57043.jpg,The Rose of Versailles,https://myanimelist.net/anime/338/Versailles_no_Bara
Yoru Ni Kakeru,Music,1.0,6360.0,4172.0,8.34,['Music'],        Nov 2019 - Nov 2019,"['Music video of the song ""Yoru Ni Kakeru"" by Yoasobi.']",https://cdn.myanimelist.net/images/anime/1826/114039.jpg,Racing Into The Night,https://myanimelist.net/anime/48653/Yoru_Ni_Kakeru
K-On! Movie,Movie,1.0,277579.0,162408.0,8.34,"['Comedy', 'SliceofLife', 'Music']",        Dec 2011 - Dec 2011,"[""Graduation looms for the founding members of the Light Music Club. With only a few precious weeks of school left, the girls decide to make the most of it and plan a trip abroad. Hawaii, New York, Dubai—many destinations are suggested, but after a little help from the club's precious pet turtle, Ton-chan, London is chosen as the host of their next misadventure!\n\r\nYui Hirasawa, Mio Akiyama, Tsumugi Kotobuki, Ritsu Tainaka, and Azusa Nakano will visit famous landmarks, perform live music for Londoners, and eat all sorts of delicious food, all while stumbling clumsily from place to place. But the fun won't last forever, as heartfelt songs and goodbyes will be made as their high school days together come to a close. One thing is for certain though: the undeniable friendships these girls have formed is something that will carry on long after the final scene rolls.\n\r\n[Written by MAL Rewrite]""]",https://cdn.myanimelist.net/images/anime/5/76233.jpg,K-ON! The Movie,https://myanimelist.net/anime/9617/K-On_Movie
Katanagatari,TV,12.0,494846.0,184614.0,8.34,"['Action', 'Adventure', 'Romance', 'Historical', 'MartialArts']",        Jan 2010 - Dec 2010,"['In an Edo-era Japan lush with a variety of sword-fighting styles, Shichika Yasuri practices the most unique one: Kyotouryuu, a technique in which the user\'s own body is wielded as a blade. The enigmatic seventh head of the Kyotouryuu school, Shichika lives quietly in exile with his sister Nanami until one day—the wildly ambitious strategist Togame barges into their lives.\n\r\nTogame brazenly requests that Shichika help in her mission to collect twelve unique swords, known as the ""Deviant Blades,"" for the shogunate. Shichika accepts, interested in the girl herself rather than petty politics, and thus sets out on a journey. Standing in their way are the fierce wielders of these legendary weapons as well as other power-hungry entities who seek to thwart Togame\'s objective. In order to prevail against their enemies, the duo must become an unbreakable team as they forge ahead on a path of uncertainty and peril.\n\r\n[Written by MAL Rewrite]']",https://cdn.myanimelist.net/images/anime/1112/119225.jpg,,https://myanimelist.net/anime/6594/Katanagatari
Kemono no Souja Erin,TV,50.0,75095.0,17378.0,8.34,"['Drama', 'Fantasy', 'SliceofLife']",        Jan 2009 - Dec 2009,"['In the land of Ryoza, the neighboring provinces of Shin-Ou and Tai-Kou have been at peace. Queen Shinou is the ruler of Ryoza and her greatest general, Grand Duke Taikou, defends the kingdom with his army of powerful war-lizards known as the ""Touda."" Although the two regions have enjoyed a long-standing alliance, mounting tensions threaten to spark a fierce civil war.\n\r\nWithin Ake, a village in Tai-Kou tasked with raising the Grand Duke\'s army, lives Erin, a bright girl who spends her days watching the work of her mother Soyon, the village\'s head Touda doctor. But while under Soyon\'s care, a disastrous incident befalls the Grand Duke\'s strongest Touda, and the peace that Erin and her mother had been enjoying vanishes as Soyon is punished severely. In a desperate attempt to save her mother, Erin ends up falling in a river and is swept towards Shin-Ou.\n\r\nUnable to return home, Erin must learn to lead a new life with completely different people, all while hunting for the truth of both beasts and humanity itself, with tensions between the two regions constantly escalating.\n\r\n[Written by MAL Rewrite]']",https://cdn.myanimelist.net/images/anime/9/19845.jpg,Erin,https://myanimelist.net/anime/5420/Kemono_no_Souja_Erin
Made in Abyss Movie 2: Hourou Suru Tasogare,Movie,1.0,81599.0,24722.0,8.34,"['Adventure', 'Drama', 'Fantasy', 'Mystery', 'Sci-Fi']",        Jan 2019 - Jan 2019,"[""The movie is a compilation of episodes 9-13 of the 2017 television series. Riko and Reg descend to the third layer where Riko has her first experience of the Curse. They descend to the fourth layer where Riko's arm is injured by an Orbed Piercer and Reg tries to save her. Nanachi comes to their aid and saves Riko's poisoned arm. In return Nanachi asks Reg to kill her immortal companion Mitty. Nanachi then joins Riko and Reg in their quest to reach the bottom of the Abyss.\n\r\n(Source: Wikipedia)""]",https://cdn.myanimelist.net/images/anime/1336/95168.jpg,Made in Abyss: Wandering Twilight,https://myanimelist.net/anime/37515/Made_in_Abyss_Movie_2__Hourou_Suru_Tasogare
Boku dake ga Inai Machi,TV,12.0,1687069.0,1092061.0,8.33,"['Mystery', 'Supernatural', 'Psychological', 'Seinen']",        Jan 2016 - Mar 2016,"['When tragedy is about to strike, Satoru Fujinuma finds himself sent back several minutes before the accident occurs. The detached, 29-year-old manga artist has taken advantage of this powerful yet mysterious phenomenon, which he calls ""Revival,"" to save many lives.\n\r\nHowever, when he is wrongfully accused of murdering someone close to him, Satoru is sent back to the past once again, but this time to 1988, 18 years in the past. Soon, he realizes that the murder may be connected to the abduction and killing of one of his classmates, the solitary and mysterious Kayo Hinazuki, that took place when he was a child. This is his chance to make things right.\n\nBoku dake ga Inai Machi follows Satoru in his mission to uncover what truly transpired 18 years ago and prevent the death of his classmate while protecting those he cares about in the present.\n\r\n[Written by MAL Rewrite]']",https://cdn.myanimelist.net/images/anime/10/77957.jpg,ERASED,https://myanimelist.net/anime/31043/Boku_dake_ga_Inai_Machi
Douluo Dalu: Xiaowu Juebie,ONA,13.0,7294.0,2638.0,8.33,"['Action', 'Adventure', 'Fantasy', 'Romance', 'Historical', 'MartialArts']",        May 2020 - Aug 2020,['Fifth part of Douluo Dalu.'],https://cdn.myanimelist.net/images/anime/1424/113993.jpg,,https://myanimelist.net/anime/42498/Douluo_Dalu__Xiaowu_Juebie
Evangelion: 2.0 You Can (Not) Advance,Movie,1.0,432210.0,260076.0,8.33,"['Action', 'Drama', 'Sci-Fi', 'Mecha', 'Psychological']",        Jul 2009 - Jul 2009,"[""When the threat of the Angel menace escalates, mankind's defense force is pushed to its limits, with NERV at the forefront of the struggle. Shinji Ikari and his partner Rei Ayanami are assisted by two new pilots: the fiery Asuka Langley Shikinami and the mysterious Mari Illustrious Makinami.\n\r\nWith the aid of their mechanized Evangelion units, equipped with weapons perfect for engaging their monstrous opponents, the four young souls fight desperately to protect their loved ones and prevent an impending apocalypse. But when startling secrets are brought to light, will the heroes' greatest challenge prove to be the monsters...or humanity itself?\n\r\n[Written by MAL Rewrite]""]",https://cdn.myanimelist.net/images/anime/5/74983.jpg,,https://myanimelist.net/anime/3784/Evangelion__20_You_Can_Not_Advance
Fate/stay night: Unlimited Blade Works 2nd Season,TV,13.0,721299.0,472012.0,8.33,"['Action', 'Fantasy', 'Supernatural']",        Apr 2015 - Jun 2015,"[""In the midst of the Fifth Holy Grail War, Caster sets her plans into motion, beginning with the capture of Shirou's Servant Saber. With the witch growing ever more powerful, Rin and Archer determine she is a threat that must be dealt with at once. But as the balance of power in the war begins to shift, the Master and Servant find themselves walking separate ways.\n\r\nMeanwhile, despite losing his Servant and stumbling from injuries, Shirou ignores Rin's warning to abandon the battle royale, forcing his way into the fight against Caster. Determined to show his resolve in his will to fight, Shirou's potential to become a protector of the people is put to the test.\n\r\nAmidst the bloodshed and chaos, the motivations of each Master and Servant are slowly revealed as they sacrifice everything in order to arise as the victor and claim the Holy Grail.\n\r\n[Written by MAL Rewrite]""]",https://cdn.myanimelist.net/images/anime/11/72863.jpg,Fate/stay night [Unlimited Blade Works] Season 2,https://myanimelist.net/anime/28701/Fate_stay_night__Unlimited_Blade_Works_2nd_Season
Hotarubi no Mori e,Movie,1.0,683653.0,382130.0,8.33,"['Drama', 'Romance', 'Supernatural', 'Shoujo']",        Sep 2011 - Sep 2011,"[""Intrigued by the tale of a mountain god, six-year-old Hotaru Takegawa loses her way in the ancient forest while visiting her uncle. Exhausted and desperate for help, Hotaru is thrilled to find a masked forest spirit named Gin. She learns the hard way that she should not touch the boy, or he would disappear. In spite of this, Gin leads Hotaru out of the forest and warns her never to return when she promises to come again with a gift.\n\r\nPaying no heed to his cautionary words, and despite being separated by both distance and planes of existence, Hotaru and Gin become close friends as she visits him every summer. However, their relationship and resolve are put to the test, when romantic feelings conflict with the one and only rule.\n\r\nBased on Yuki Midorikawa's manga of the same name, Hotarubi no Mori e is a tale of friendship and compromise of two people who should never have crossed paths, as their lives become hopelessly intertwined.\n\r\n[Written by MAL Rewrite]""]",https://cdn.myanimelist.net/images/anime/1599/112267.jpg,,https://myanimelist.net/anime/10408/Hotarubi_no_Mori_e
Natsume Yuujinchou Go Specials,Special,2.0,37215.0,16531.0,8.33,"['Drama', 'SliceofLife', 'Supernatural', 'Demons', 'Shoujo']",        Mar 2017 - Apr 2017,['Two special episodes bundled in the fourth and fifth volume of the Blu-ray/DVD.'],https://cdn.myanimelist.net/images/anime/3/84887.jpg,,https://myanimelist.net/anime/34534/Natsume_Yuujinchou_Go_Specials
Romeo no Aoi Sora,TV,33.0,41897.0,14342.0,8.33,"['Adventure', 'Drama', 'SliceofLife', 'Historical']",        Jan 1995 - Dec 1995,"['Romeo is a kindhearted and courageous boy living with his family in a small village in Switzerland. Unfortunately, Romeo becomes the interest of a man named Luini, known as ""The God of Death,"" who is infamous for buying children and selling them as chimney sweeps in Milan. While visiting the village, Luini burns down Romeo\'s family cornfield in an attempt to have Romeo as his own. With the cornfield gone and his father sustaining a head injury trying to put out the fire, Romeo bravely sells himself to the God of Death in order to help his family afford a doctor. \n\r\nOn his way to Milan, Romeo meets a boy named Alfredo Martini and they quickly become friends. Just as Alfredo is sold to a different master, the two boys swear eternal friendship and vow to meet again. As a chimney sweep, Romeo faces many hardships and abuse, especially from his master\'s family and a gang known as the Wolf Pack. But after reuniting with Alfredo, the two form a fraternity of chimney sweeps called ""The Black Brothers,"" who will learn to fight against the Wolf Pack and help each other in times of need.\n\r\n[Written by MAL Rewrite]']",https://cdn.myanimelist.net/images/anime/4/17979.jpg,Romeo and the Black Brothers,https://myanimelist.net/anime/2559/Romeo_no_Aoi_Sora
Sakamichi no Apollon,TV,12.0,325605.0,146494.0,8.33,"['Drama', 'Romance', 'Music', 'School', 'Josei']",        Apr 2012 - Jun 2012,"[""Introverted classical pianist and top student Kaoru Nishimi has just arrived in Kyushu for his first year of high school. Having constantly moved from place to place since his childhood, he abandons all hope of fitting in, preparing himself for another lonely, meaningless year. That is, until he encounters the notorious delinquent Sentarou Kawabuchi.\n\r\nSentarou's immeasurable love for jazz music inspires Kaoru to learn more about the genre, and as a result, he slowly starts to break out of his shell, making his very first friend. Kaoru begins playing the piano at after-school jazz sessions, located in the basement of fellow student Ritsuko Mukae's family-owned record shop. As he discovers the immense joy of using his musical talents to bring enjoyment to himself and others, Kaoru's summer might just crescendo into one that he will remember forever.\n\nSakamichi no Apollon is a heartwarming story of friendship, music, and love that follows three unique individuals brought together by their mutual appreciation for jazz.\n\r\n[Written by MAL Rewrite]""]",https://cdn.myanimelist.net/images/anime/1604/98654.jpg,Kids on the Slope,https://myanimelist.net/anime/12531/Sakamichi_no_Apollon
Natsume Yuujinchou,TV,13.0,460038.0,156999.0,8.32,"['Drama', 'SliceofLife', 'Supernatural', 'Demons', 'Shoujo']",        Jul 2008 - Sep 2008,"['While most fifteen-year-old boys, in one way or another, harbor secrets that are related to girls, Takashi Natsume has a peculiar and terrifying secret involving youkai: for as long as he can remember, he has been constantly chased by these spirits. Natsume soon discovers that his deceased grandmother Reiko had passed on to him the Yuujinchou, or ""Book of Friends,"" which contains the names of the spirits whom she brought under her control. Now in Natsume\'s possession, the book gives Reiko\'s grandson this power as well, which is why these enraged beings now haunt him in hopes of somehow attaining their freedom.\n\r\nWithout parents and a loving home, and constantly being hunted by hostile, merciless youkai, Natsume is looking for solace—a place where he belongs. However, his only companion is a self-proclaimed bodyguard named Madara. Fondly referred to as Nyanko-sensei, Madara is a mysterious, pint-sized feline spirit who has his own reasons for sticking with the boy.\n\r\nBased on the critically acclaimed manga by Yuki Midorikawa, Natsume Yuujinchou is an unconventional and supernatural slice-of-life series that follows Natsume as he, with his infamous protector Madara, endeavors to free the spirits bound by his grandmother\'s contract.\n\r\n[Written by MAL Rewrite]']",https://cdn.myanimelist.net/images/anime/1681/108439.jpg,Natsume's Book of Friends,https://myanimelist.net/anime/4081/Natsume_Yuujinchou
NHK ni Youkoso!,TV,24.0,613586.0,277518.0,8.32,"['Comedy', 'Drama', 'Romance', 'Psychological']",        Jul 2006 - Dec 2006,"[""Twenty-two-year-old college dropout Tatsuhiro Satou has been a hikikomori for almost four years now. In his isolation, he has come to believe in many obscure conspiracy theories, but there is one in particular which he holds unshakable faith in: the theory that the evil conspirator behind his shut-in NEET (Not in Employment, Education or Training) status is the Nihon Hikikomori Kyokai (NHK)—an evil and secret organization dedicated to fostering the spread of hikikomori culture.\n\nNHK ni Youkoso! is a psychological dramedy that follows Tatsuhiro as he strives to escape from the NHK's wicked machinations and the disease of self-wrought isolation, while struggling to even just leave his apartment and find a job. His unexpected encounter with the mysterious Misaki Nakahara might signal a reversal of fortune for Tatsuhiro, but with this meeting comes the inevitable cost of having to face his greatest fear—society.\n\r\n[Written by MAL Rewrite]""]",https://cdn.myanimelist.net/images/anime/3/52675.jpg,Welcome to the N.H.K.,https://myanimelist.net/anime/1210/NHK_ni_Youkoso
